,quoteID,quotation,speaker,qids,date,numOccurrences,urls,phase,speaker_prob,url_countries
115503,2017-04-07-154558,"We've been calling for its retrofitting even before the Bohol [ earthquake ],",None,,2017-04-07 16:02:27,1,['http://newsinfo.inquirer.net/887474/taal-basilica-collapse-farfetched-says-priest'],E,0.6571,['RP']
98924,2017-04-09-063069,"The reason old churches collapsed during the Bohol earthquake in October 2013 is because of all that rain that the materials were exposed to. The water creates small gaps between the stones. So, when the earthquake struck, may galawan sa walls, halos lahat ng simbahan sabay-sabay nagbagsakan,",Ramon Orlina,Q15881152,2017-04-09 00:16:55,1,['http://lifestyle.inquirer.net/259526/taal-basilica-verge-collapse/'],E,0.6595,['RP']
58353,2017-03-19-010160,"Excellency, there is respect and mutual understanding honed by these interactions. This is why in times of calamities, both our sides have been ready to provide assistance. I thank you and the people of Myanmar for the timely assistance, particularly for those who were affected by typhoon Pablo, which hit my island in Mindanao, the earthquake in Bohol, and the typhoon [ Haiyan ]. Indeed, it is in times of need that you know who are your friends,",Rodrigo Duterte,Q457786,2017-03-19 21:03:39,1,['http://abs-cbnnews.com/news/03/20/17/as-duterte-leaves-myanmar-he-renews-pitch-for-war-on-illegal-drugs'],E,0.9424,['RP']
38314,2018-11-29-035097,"I am very optimistic in this route. Bohol is a very good example of how the government works for the people. The province has experienced an earthquake, but its people were able to rise again,",Edgar Chatto,Q2333506,2018-11-29 09:53:50,1,['http://www.canadianinquirer.net/2018/11/29/airasia-eyes-bohol-panglao-airport-as-5th-hub/'],E,0.628,['RP']
50473,2018-07-28-001276,ABS-CBN's Sagip Kapamilya delivers relief goods to quake victims in Bohol,None,,2018-07-28 03:39:45,1,['http://geology.wikia.com/wiki/2013_Bohol_earthquake?diff=5929&oldid=0'],E,0.8754,['US']
104781,2018-07-28-033604,Mushroom Cultivation Helps Communities In Bohol Rise After The Quake -- Philippines,None,,2018-07-28 03:39:45,1,['http://geology.wikia.com/wiki/2013_Bohol_earthquake?diff=5929&oldid=0'],E,0.9341,['US']
54813,2018-07-28-008875,Eureka! Fault that triggered quake discovered in northern Bohol,Howie Severino,Q12964789,2018-07-28 03:39:45,1,['http://geology.wikia.com/wiki/2013_Bohol_earthquake?diff=5929&oldid=0'],E,0.7985,['US']
4090,2018-07-28-037749,Phivolcs: New fault line may have been source of Bohol earthquake,None,,2018-07-28 03:39:45,1,['http://geology.wikia.com/wiki/2013_Bohol_earthquake?diff=5929&oldid=0'],E,0.9152,['US']
9325,2018-07-28-031401,"Kapuso Foundation, naghahanda ng relief goods para sa mga quake victim sa Bohol",Mel Tiangco,Q3543520,2018-07-28 03:39:45,1,['http://geology.wikia.com/wiki/2013_Bohol_earthquake?diff=5929&oldid=0'],E,0.7006,['US']
108756,2019-05-06-084356,These movements are very powerful [ that ] they can generate a booming sound. Such were the accounts in Bohol province [ in 2013 ] and even during the earthquake on April 22.,Mahar Lagmay,Q21718895,2019-05-06 23:23:38,1,['https://newsinfo.inquirer.net/1114682/fault-line-mapping-reduces-quake-damage-saves-lives-experts'],E,0.7151,['RP']
95597,2019-03-22-085766,"The NHCP was in charge of the conservation of 10 old churches in Bohol, central Philippines. Which were destroyed by a 7.2 magnitude earthquake in 2013. The contractor was 401. The NHCP and 401 seem to have sweet memories.",None,,2019-03-22 10:54:41,1,['http://abs-cbnnews.com/ancx/culture/spotlight/03/22/19/panic-at-the-met-where-is-the-theater-weve-all-been-promised#'],E,0.8823,['RP']
140163,2019-05-06-040946,"In Bohol, the only mapped fault there is the Eastern Bohol fault, which was down south of the island, but the earthquake happened north of Bohol,",Mahar Lagmay,Q21718895,2019-05-06 23:23:38,1,['https://newsinfo.inquirer.net/1114682/fault-line-mapping-reduces-quake-damage-saves-lives-experts'],E,0.864,['RP']
78833,2019-10-15-075977,"Six years later, we all look back with pride at how the Boholanos showed unity, strength, perseverance, and resiliency when that 7.2 magnitude tremor hit our beloved Bohol. The spirit of giving and sharing paved the way to early recovery,",Edgar Chatto,Q2333506,2019-10-15 06:30:57,1,['https://newsinfo.inquirer.net/1177764/bohol-folk-remember-earthquake-that-killed-222-people-6-years-ago'],E,0.9234,['RP']
27131,2020-01-18-048648,"We are hoping that PhilHealth (Philippine Health Insurance Corp.) will immediately grant continuous access to health care benefits. They had this implemented for [ the ] Bohol earthquake and [ Typhoon ] `Yolanda' victims. Hospitalization needs are higher, especially among the young and are expected for the old,",None,,2020-01-18 00:04:55,1,['https://www.manilatimes.net/2020/01/18/news/top-stories/drugstores-warned-vs-high-prices/675285/'],E,0.469,['RP']
